Article_Name,Link,About,Skills
Android ViewBinding Migration,https://medium.com/@kamilmasyhur/android-viewbinding-migration-16070e24b752?source=topic_page---------0------------------1----------,--------,andriod development
Large-screen UI in the Google I/O App,https://medium.com/androiddevelopers/large-screen-ui-in-the-google-i-o-app-c4d3ddd98bd0?source=topic_page---------1------------------1----------,--------,andriod development
Actor based peaceful state management,https://proandroiddev.com/actor-based-peaceful-state-management-4ea7ca2a1ae9?source=topic_page---------2------------------1----------,--------,andriod development
What Matters Most to You? Here’s How to Find Out.,https://betterhumans.pub/what-matters-most-to-you-heres-how-to-find-out-13ac057b7850?source=topic_page---------4------------------1----------,--------,andriod development
Video Recording and Playback App in React Native Expo (Android & IOS),https://medium.com/geekculture/video-recording-and-playback-app-in-react-native-expo-android-ios-f6390bab65e8?source=topic_page---------5------------------1----------,--------,andriod development
Automated migration of your projects to Bazel build system with Airin,https://proandroiddev.com/automated-migration-of-your-projects-to-bazel-build-system-with-airin-304fa8b3680c?source=topic_page---------6------------------1----------,--------,andriod development
RecyclerView with different items and multiple columns grid,https://serjantarbuz.medium.com/recyclerview-with-different-items-and-multiple-columns-grid-724618d5d4e4?source=topic_page---------7------------------1----------,--------,andriod development
Writing your profiler to analyze application performance on Android,https://medium.com/@FunCorp/writing-your-profiler-to-analyze-application-performance-on-android-f343fe8a1b5b?source=topic_page---------8------------------1----------,--------,andriod development
How to create a view programmatically with Android MotionLayout,https://medium.com/@grazianorizzi/how-to-create-a-view-programmatically-with-android-motionlayout-832d92490162?source=topic_page---------9------------------1----------,--------,andriod development
Integration of Fingerprint and 3D Face Authentication with BioAuthn in Android apps using Huawei…,https://medium.com/huawei-developers/beginner-integration-of-fingerprint-and-3d-face-authentication-with-bioauthn-in-android-apps-using-ade8280b0908?source=topic_page---------10------------------1----------,--------,andriod development
Now in Android #44,https://medium.com/androiddevelopers/now-in-android-44-88e438622436?source=topic_page---------11------------------1----------,--------,andriod development
Top Android MVI libraries in 2021,https://proandroiddev.com/top-android-mvi-libraries-in-2021-de1afe890f27?source=topic_page---------12------------------1----------,--------,andriod development
Introducing Navigation-Material ,https://jossiwolf.medium.com/introducing-navigation-material-%EF%B8%8F-a19ed5cc33fd?source=topic_page---------13------------------1----------,--------,andriod development
Animations in Navigation Compose,https://medium.com/androiddevelopers/animations-in-navigation-compose-36d48870776b?source=topic_page---------14------------------1----------,--------,andriod development
Writing a Serverless Android app (ft. Huawei’s AppGallery Connect) — Part 3 — More CloudDB,https://medium.com/huawei-developers/writing-a-serverless-android-app-ft-huaweis-appgallery-connect-part-3-more-clouddb-d64fa33b5f4a?source=topic_page---------15------------------1----------,--------,andriod development
State in Jetpack Compose,https://agarasul.medium.com/state-in-jetpack-compose-f2c0dc20d442?source=topic_page---------16------------------1----------,--------,andriod development
The Dark Art of Building an Enterprise-Grade Mobile App — Part 1,https://medium.com/@sundarsingh_2383/the-dark-art-of-building-an-enterprise-grade-mobile-app-part-1-34ff34387deb?source=topic_page---------17------------------1----------,--------,andriod development
The Dark Art of Building an Enterprise-Grade Mobile App — Part 2,https://medium.com/@sundarsingh_2383/the-dark-art-of-building-an-enterprise-grade-mobile-app-part-2-950f1d9e911b?source=topic_page---------18------------------1----------,--------,andriod development
Re-writing the AOSP Calendar App in Kotlin,https://medium.com/androiddevelopers/re-writing-the-aosp-calendar-app-in-kotlin-48ceb0e3a65c?source=topic_page---------19------------------1----------,--------,andriod development
Camera2 - Everything You Wanted To Know,https://proandroiddev.com/camera2-everything-you-wanted-to-know-2501f9fd846a?source=topic_page---------20------------------1----------,--------,andriod development
Configure your Android Application remotely with Firebase Remote Config,https://medium.com/@dokkar-rachid-reda/configure-your-android-application-remotely-with-firebase-remote-config-aa012073ada0?source=topic_page---------21------------------1----------,--------,andriod development
Which Mobile Development Framework Is Right For You?,https://javascript.plainenglish.io/which-mobile-development-framework-is-right-for-you-57d0c1bbfaf0?source=topic_page---------22------------------1----------,--------,andriod development
Google login in Ionic Capacitor app with Angular,https://medium.com/enappd/google-login-in-ionic-capacitor-app-with-angular-bb0e8fbba620?source=topic_page---------23------------------1----------,--------,andriod development
Implementing a Splash Screen in Android (Kotlin),https://medium.com/@tom.truyen/implementing-a-splash-screen-in-android-kotlin-3f999b5783bd?source=topic_page---------24------------------1----------,--------,andriod development
Navigating lists in Jetpack Compose with LazyListState,https://mattrobertson333.medium.com/navigating-lists-in-jetpack-compose-with-lazyliststate-b416d7448014?source=topic_page---------25------------------1----------,--------,andriod development
Get Ready for a Hot Phone Fall,https://debugger.medium.com/get-ready-for-a-hot-phone-fall-2088fe088e3e?source=topic_page---------26------------------1----------,--------,andriod development
Design Patterns in Android with Kotlin,https://medium.com/@bhakadepatil/design-patterns-in-android-with-kotlin-a64484665eeb?source=topic_page---------27------------------1----------,--------,andriod development
Hilt — The official new DI Library for Android (Part-2),https://medium.com/simform-engineering/hilt-the-official-new-di-library-for-android-part-2-995ed894cec0?source=topic_page---------28------------------1----------,--------,andriod development
 INTRODUCING Direct Music Player,https://ibrajix.medium.com/introducing-direct-music-player-ac28ea22b326?source=topic_page---------29------------------1----------,--------,andriod development
Exploring App Bars in Jetpack Compose,https://betterprogramming.pub/exploring-app-bars-in-jetpack-compose-94a7e0920e32?source=topic_page---------30------------------1----------,--------,andriod development
Recycler View Internals — I: Birth Of ViewHolder,https://proandroiddev.com/recycler-view-internals-i-birth-of-viewholder-ae536760839c?source=topic_page---------31------------------1----------,--------,andriod development
Beginner: Find yoga pose using Huawei ML kit skeleton detection — Part 1,https://medium.com/huawei-developers/beginner-find-yoga-pose-using-huawei-ml-kit-skeleton-detection-part-1-4517f325700d?source=topic_page---------32------------------1----------,--------,andriod development
Android OCR Recognition for Passport MRZ,https://yushulx.medium.com/android-ocr-recognition-for-passport-mrz-cfe03f6b5fad?source=topic_page---------33------------------1----------,--------,andriod development
"Loading images for Jetpack Compose using Glide, Coil, and Fresco",https://proandroiddev.com/loading-images-for-jetpack-compose-using-glide-coil-and-fresco-1211261a296e?source=topic_page---------34------------------1----------,--------,andriod development
Migrate from Dagger to Hilt — A Step by Step Guide,https://trinhlbk1991.medium.com/migrate-from-dagger-to-hilt-a-step-by-step-guide-ac249d0eac07?source=topic_page---------35------------------1----------,--------,andriod development
Project Roadmap — Lido for Solana,https://medium.com/chorus-one/project-roadmap-lido-for-solana-88e6a20950c5?source=topic_page---------0------------------1----------,Lido for Solana Mainnet will launch soon. Here’s what we have been up to!,blockchain
Hedging Against Bad Weather with Cloud Datasets and Blockchain Oracles,https://medium.com/google-cloud/hedging-against-bad-weather-with-cloud-datasets-and-blockchain-oracles-7ba3e0150304?source=topic_page---------1------------------1----------,Open weather data and blockchain smart contracts can — through sustainable agriculture — mitigate climate change,blockchain
"Meet DSCVR, a User-Controlled Decentralized Social Network Running Entirely On-Chain",https://medium.com/dfinity/meet-dscvr-a-user-controlled-decentralized-social-network-running-entirely-on-chain-1ffba073950f?source=topic_page---------2------------------1----------,"Powered end-to-end by the Internet Computer blockchain, DSCVR delivers a fast web experience while enabling community-based governance.",blockchain
Blockchain in Gaming,https://medium.com/darkbyte-newfinance/blockchain-in-gaming-520d19a4295a?source=topic_page---------4------------------1----------,I love playing video games growing up. I used to sneak off from my bed at midnight to play pokemon until 3 AM in primary school. Pokemon…,blockchain
More on the Security Against Fee Sniping in RSK,https://medium.com/iovlabs-innovation-stories/more-on-the-security-against-fee-sniping-in-rsk-602a59591d7f?source=topic_page---------5------------------1----------,In a previous article we discussed different fee sniping attacks and we analyzed how they could impact RSK. In this article we dig deeper…,blockchain
How to send decentralized push notifications?,https://medium.com/geekculture/how-to-send-decentralized-push-notifications-d851ae0a95ea?source=topic_page---------6------------------1----------,Using NodeJS & Ethereum Blockchain,blockchain
PAID Network is now live on BSC — Convert your $PAID ERC20 into BEP20!,https://paidnetwork.medium.com/paid-network-is-now-live-on-bsc-convert-your-paid-erc20-into-bep20-1658cdee98d2?source=topic_page---------7------------------1----------,"PAID Network is now integrated and live on the Binance Smart Chain, bringing the full power of BSC to all PAID products.",blockchain
Create a Slack Bot for Bitcoin Price Updates Using GCP Cloud Functions,https://betterprogramming.pub/create-a-slack-bot-for-bitcoin-price-updates-using-gcp-cloud-functions-a672fc34287c?source=topic_page---------8------------------1----------,Build your own bot in less than 15 minutes,blockchain
Battle of The Blockchains,https://bettermarketing.pub/battle-of-the-blockchains-1d943ed7dd42?source=topic_page---------9------------------1----------,"The best blockchain may not win, but the first blockchain to market to the masses might.",blockchain
Red States and Blue States vs Crypto,https://alexisgoldstein.medium.com/red-states-and-blue-states-vs-crypto-ec0320a685d1?source=topic_page---------10------------------1----------,"Bipartisan language in the infrastructure bill clarifies tax reporting responsibilities for crypto market actors, while the bipartisan…",blockchain
Can a blockchain be decentralized on the cloud?,https://levelup.gitconnected.com/can-a-blockchain-be-decentralized-on-the-cloud-807959af28ef?source=topic_page---------11------------------1----------,"Many cloud providers such as AWS, Azure, GCP and IBM are providing “Blockchain as a Service” or BaaS, but…. does it contribute to the…",blockchain
Why a Simple Payments App is Integral to the Success of Terra’s Blockchain,https://adam-cheshier.medium.com/why-a-simple-payments-app-is-integral-to-the-success-of-terras-blockchain-a68524199b39?source=topic_page---------12------------------1----------,How CHAI is leading Terra to the moon.,blockchain
Build a Decentralized Ticket Exchange Using the Flow Blockchain,https://betterprogramming.pub/build-a-decentralized-ticket-exchange-using-the-flow-blockchain-ed0eaf7745d0?source=topic_page---------14------------------1----------,Adding utility to NFTs using Dapper Labs’ promising new platform,blockchain
Project Watch: This Week’s Look At The Projects Building A Decentralized World,https://paidnetwork.medium.com/project-watch-this-weeks-look-at-the-projects-building-a-decentralized-world-b34d5367a0a6?source=topic_page---------15------------------1----------,"The potential of blockchain goes far beyond its ability to store wealth. At PAID Network, we believe in a vision where blockchain provides…",blockchain
Cryptocurrency: The Future of Finance,https://medium.com/geekculture/cryptocurrency-the-future-of-finance-11bece1f988c?source=topic_page---------16------------------1----------,"Since the invention of Bitcoin in 2009, it has caught the attention of people and interest has developed over time as it has now caught…",blockchain
Current status of data security and the need for blockchain technology,https://medium.com/@MINENetwork/current-status-of-data-security-and-the-need-for-blockchain-technology-a4f2ecad9133?source=topic_page---------17------------------1----------,Status of management and security of personal data,blockchain
Blockchain and Cryptocurrencies Quickly Replacing the Legacy SWIFT Financial System,https://medium.com/cryptocurrencies-ups-and-down/blockchain-and-cryptocurrencies-quickly-replacing-the-legacy-swift-financial-system-5d7b01e86a52?source=topic_page---------18------------------1----------,"In our traditional and centralized financial system, SWIFT operates a world-class financial telegraphic network through which banks and…",blockchain
Thoughts on NFT Marketing (and Why It’s Easier for Generative and/or Larger Sets / Collections),https://medium.com/web-design-web-developer-magazine/thoughts-on-nft-marketing-and-why-its-easier-for-generative-and-or-larger-sets-collections-73e4f80f903b?source=topic_page---------19------------------1----------,"If you’ve been following my writings on Non-Fungible Tokens (NFTs), and especially generative NFT programming, you’ll be familiar already…",blockchain
Uniswap Pulls Tokenized Stocks & Derivatives Following Regulatory Warnings,https://alexisgoldstein.medium.com/following-regulatory-warnings-uniswap-pulls-tokenized-stocks-derivatives-57281d15231e?source=topic_page---------20------------------1----------,“We’ll go after the person that’s essentially operating an unlicensed exchange”: CFTC Commissioner Dan Berkovitz,blockchain
How to create a permanent uncensorable message on the Ethereum blockchain,https://levelup.gitconnected.com/how-to-create-a-permanent-uncensorable-message-on-the-ethereum-blockchain-afd1ad23fa5e?source=topic_page---------21------------------1----------,"From wedding proposals to political messages, people have been writing uncensorable messages all over the Ethereum blockchain. Learn how to…",blockchain
"Blockchain Technology; Definition, and How It Works",https://medium.com/geekculture/blockchain-technology-definition-and-how-it-works-369f9b1efe1a?source=topic_page---------22------------------1----------,The blockchain is a digital network or an array of codes put together to form a secure platform that helps to keep track of digital assets…,blockchain
Build a Complete Environment to Secure Smart-contracts Development,https://betterprogramming.pub/build-a-complete-environment-to-secure-smart-contracts-development-50c1531f32ce?source=topic_page---------23------------------1----------,Prepare a solid foundation for your protocol development,blockchain
The Top 3 Books to Read if you actually Want to Understand Blockchain,https://medium.com/geekculture/the-top-3-books-to-read-if-you-actually-want-to-understand-blockchain-784ddcf759f7?source=topic_page---------24------------------1----------,"More tech, less hype",blockchain
"Introducing, The Sushi Next Generation AMM: Trident",https://medium.com/sushiswap-org/introducing-the-sushi-next-generation-amm-trident-7dea6aa3cbc2?source=topic_page---------25------------------1----------,"Welcome to the new “not just a fork” Sushi AMM, Trident, because who needs a fork when you have a Trident?",blockchain
Retroactive Public Goods Funding,https://medium.com/ethereum-optimism/retroactive-public-goods-funding-33c9b7d00f0c?source=topic_page---------26------------------1----------,"Note: The Optimism team has long been in search of a solution on how to sustainably fund public goods, and we now have the structure of our…",blockchain
How Cardano Plan To Reach 1B Users 2021 Goals,https://medium.com/coinmonks/how-cardano-plan-to-reach-1b-users-2021-goals-11eaee5b20d?source=topic_page---------27------------------1----------,Cardano is a protocol with a goal to reach one billion users. With many companies independent developers involved. Cardano Foundation is…,blockchain
Creating an Ethereum Token to Enable a Decentralized Rent-to-Own Network,https://towardsdatascience.com/creating-an-ethereum-token-to-enable-a-decentralized-rent-to-own-network-cc3786cf1142?source=topic_page---------28------------------1----------,The most sustainable applications of cryptocurrencies involve re-thinking how we establish trust in everyday relationships.,blockchain
The future of payments: Programmable payments for the Internet-of-Things (IoT),https://philippsandner.medium.com/the-future-of-payments-programmable-payments-for-the-internet-of-things-iot-d4905e3959e7?source=topic_page---------30------------------1----------,"Digitization is taking hold of entire industries, including in Germany. The area of the “Internet of Things (IoT)”, in particular, promises…",blockchain
How To Mine the Blockchain in Java,https://betterprogramming.pub/how-to-mine-the-blockchain-in-java-9647de36a8fc?source=topic_page---------31------------------1----------,A Java implementation for users and miners,blockchain
How can Blockchain Technology Reach Mass Adoption?,https://medium.com/geekculture/how-can-blockchain-technology-reach-mass-adoption-1d004d116dc?source=topic_page---------32------------------1----------,And why blockchain is just a financial arcade,blockchain
Audit and the Importance of Security in the Cryptocurrency Ecosystem,https://medium.com/codex/audit-and-the-importance-of-security-in-the-cryptocurrency-ecosystem-806a0953e47c?source=topic_page---------33------------------1----------,One of the advantages of having a computer auditor to support the audit of annual accounts is because he/she has the opportunity to visit…,blockchain
The Best DeFi Tools,https://medium.com/stakingbits/the-best-defi-tools-4e1d218f5488?source=topic_page---------34------------------1----------,What are some of the best DeFi tools that help you understand and keep track of the wider DeFi ecosystem?,blockchain
Cryptocurrency Guide: The Basics of Crypto Trading Analysis,https://medium.com/@johnoladokuno/cryptocurrency-guide-the-basics-of-crypto-trading-analysis-4e25f075b87f?source=topic_page---------0------------------1----------,The cryptocurrency space is one that needs a lot of research or the investor or trader to make a profit. Crypto trading analysis requires…,cryptocurrency
Riding Cardano Trend to $1.6 With Swings to Achieve Maximum Return,https://medium.com/yardcouch-com/riding-cardano-trend-to-1-6-with-swings-to-achieve-maximum-return-f02759a2f28f?source=topic_page---------1------------------1----------,An Overview of My Hybrid Strategy on a Mid-Term Timeframe on a Promising Crypto,cryptocurrency
"Why Billionaire’s Hate Bitcoin (And Other Crypto), But You Shouldn’t",https://themakingofamillionaire.com/why-billionaires-hate-bitcoin-and-other-crypto-but-you-shouldn-t-510498a7f55e?source=topic_page---------2------------------1----------,A revolution in “money”,cryptocurrency
"What is Efinity, the New NFT Blockchain from the team behind Enjin Coin?",https://bitpushnews.medium.com/what-is-efinity-the-new-nft-blockchain-from-the-team-behind-enjin-coin-1ba2ef28a978?source=topic_page---------4------------------1----------,"Enjin, the team behind the multi-billion dollar Enjin Coin, has recently released their new project, Efinity. Built with Polkadot…",cryptocurrency
ICy: A Decentralized Lending Protocol on the Internet Computer,https://medium.com/sciecon-ama/icy-a-decentralized-lending-protocol-on-the-internet-computer-3b4eefb20313?source=topic_page---------5------------------1----------,The AMA Interview for Duke CS+ DeFi Project-ICy team,cryptocurrency
Q: How to Make Crypto a Little Less Cryptic?,https://medium.com/wealthsimple/q-how-to-make-crypto-a-little-less-cryptic-5cadf901446a?source=topic_page---------6------------------1----------,A: Invite currency-curious customers to play cards — and take a quiz.,cryptocurrency
Bitcoin Is About To PumP Because Of This. Time To Buy Now,https://medium.com/coinmonks/bitcoin-is-about-to-pump-because-of-this-time-to-buy-now-61d45bd279a6?source=topic_page---------7------------------1----------,There’s something in the works that could be the next big thing to skyrocket the price of Bitcoin.,cryptocurrency
Dashboards to track EIP-1559 ETH burn,https://medium.com/stakingbits/dashboards-to-track-eip-1559-eth-burn-a38b86bfe8f3?source=topic_page---------8------------------1----------,"With the Ethereum latest upgrade London live at block 12965000, the network has changed its fee market structure into one that reduces fee…",cryptocurrency
How to List NFT Art on OpenSea,https://regia-marinho.medium.com/how-to-list-nft-art-on-opensea-12009b51fe98?source=topic_page---------9------------------1----------,7 steps you’ll need to create your NFT.,cryptocurrency
What You Need To Know Before Buying Cryptocurrency,https://fintelics.medium.com/what-you-need-to-know-before-buying-cryptocurrency-97a86cb93bc3?source=topic_page---------10------------------1----------,What You Need To Know Before Buying Cryptocurrency,cryptocurrency
Towards Decentralized Protocols: Call for Collaborations,https://medium.com/sciecon-ama/towards-decentralized-protocols-call-for-collaborations-eec84c0ba154?source=topic_page---------11------------------1----------,The AMA Interview for Duke CS+ Graduate Mentor Derrick Adam,cryptocurrency
"That’s Why Buying More ADA, ETH, BTC, LINK, VET",https://medium.com/coinmonks/thats-why-buying-more-ada-eth-btc-link-vet-5-000-usd-37020c063a66?source=topic_page---------12------------------1----------,It has been wild months for Cryptos. The entire crypto market was down more than 400 billion dollars at one point. China has plans to shut…,cryptocurrency
Ethereum’s ‘London hard fork’ lifts the Crypto market,https://medium.com/technicity/ethereums-london-hard-fork-lifts-the-crypto-market-603b146b2566?source=topic_page---------13------------------1----------,The second-largest crypto platform has provided the much-needed lift to the broader market with the upgrade,cryptocurrency
How to Invest in Circle Stock,https://jhargrave.medium.com/how-to-invest-in-circle-stock-ac1e012f44f2?source=topic_page---------14------------------1----------,"Explanation of the blockchain company behind USDC, and how to buy their stock.",cryptocurrency
Why It’s Wrong To Think HODLing Hurts The Blockchain,https://medium.com/geekculture/why-its-wrong-to-think-hodling-hurts-the-blockchain-f8b2ee305328?source=topic_page---------15------------------1----------,"The hypothetical situation in which everyone in the world HODLs is unrealistic, and will never reflect the use of real blockchains",cryptocurrency
You Can Belong to Future Tokens Where You‘ll Outstand With Your Best Skills,https://medium.com/collective-growth/you-can-belong-to-future-tokens-where-you-ll-outstand-with-your-best-skills-f8270336288e?source=topic_page---------16------------------1----------,"Communities will rise in a decentralized world, and create economic niches where you can explore the best of yourself.",cryptocurrency
Startup — A TV Show Ahead Of Its Time,https://medium.com/fan-fare/startup-a-tv-show-ahead-of-its-time-9758f5597a7?source=topic_page---------17------------------1----------,Creating a cryptocurrency startup in Miami’s diverse tech scene,cryptocurrency
The Beginner’s Guide to Understanding Cryptocurrency,https://medium.com/fortune-for-future/the-beginners-guide-to-understanding-cryptocurrency-568505a1878c?source=topic_page---------18------------------1----------,What exactly are cryptocurrencies? How do they work? And why should you care about them as a business owner or consumer?,cryptocurrency
How To Use Bitcoin To Get True Freedom With Money,https://www.inbitcoinwetrust.net/how-to-use-bitcoin-to-get-true-freedom-with-money-7ead60968dad?source=topic_page---------19------------------1----------,A 5 step plan that will change your life for the better.,cryptocurrency
What is the stock and crypto market going to do in the next few months? — Delta Variant update,https://medium.com/darkbyte-newfinance/what-is-the-stock-and-crypto-market-going-to-do-in-the-next-few-months-delta-variant-update-118999878a3a?source=topic_page---------20------------------1----------,The market is currently in a bullish mood but doesn’t be fooled. It should be heading down a bit further before it returns to a bull run.,cryptocurrency
Permaculture and Crypto: Green with No Envy,https://medium.com/amentum/permaculture-and-crypto-green-with-no-envy-525af61ab884?source=topic_page---------21------------------1----------,Activating Humanities’ Decentralized Exchange Grid,cryptocurrency
