Article_Name,Link,About,Skills
Quick Win — Image Descriptions,https://medium.com/@r.whitaker/quick-win-image-descriptions-b5ab2e72e76?source=topic_page---------10------------------1----------,If your images are missing descriptions those without vision won’t be getting the full experience of your app.,ios development
storyboard to swiftui,https://medium.com/swiftify/storyboard-to-swiftui-c2a52c730617?source=topic_page---------11------------------1----------,"SwiftUI has evolved since its inception, according to the iOS Developer Community Survey 34.9% of the respondents have shipped SwiftUI code",ios development
MVVM’s view model architecture with Reactive Programming,https://medium.com/@jaimejazarenoiii/mvvms-view-model-architecture-with-reactive-programming-88f8deb89184?source=topic_page---------12------------------1----------,How to clean your view model and group it by objective,ios development
5 SwiftUI List Tricks for iOS 13,https://betterprogramming.pub/5-swiftui-list-tricks-for-ios-13-7431c5347a93?source=topic_page---------13------------------1----------,"Navigation, grouped styling, bulk deletion, expandable lists, and sections",ios development
Build objects using block-based builder pattern in Swift,https://overheardswift.com/build-objects-using-block-based-builder-pattern-in-swift-a8cbf641d0e6?source=topic_page---------14------------------1----------,"In Gang of Four Design Patterns, the builder pattern is one of the classic creational design patterns. This pattern is similar to other…",ios development
Basics of Swift UI Animations,https://medium.com/simform-engineering/basics-of-swift-ui-animations-d1aa2485a5d9?source=topic_page---------15------------------1----------,A simple step to step guide to getting started with basic swiftUI Animation,ios development
An Updated SKLightNode Page,https://medium.com/geekculture/an-updated-sklightnode-page-5fe2e16af6d3?source=topic_page---------16------------------1----------,Join me to re-document some of SpriteKits Nodes under SwiftUI,ios development
A Look at StaticString In Swift,https://betterprogramming.pub/a-look-at-staticstring-in-swift-542213f3c0fe?source=topic_page---------17------------------1----------,Understand how StaticString works in Swift,ios development
Create Static Library in swift,https://kananabilzada.medium.com/create-static-library-in-swift-b7dea6e97c7?source=topic_page---------18------------------1----------,"In this tutorial, I wanna show you how create static library for your reusable code.",ios development
Multi-User Collaborative iOS AR Experiences with Agora (Part 1 of 2),https://maxxfrazer.medium.com/multi-user-collaborative-ios-ar-experiences-with-agora-part-1-of-2-3818538d0c38?source=topic_page---------19------------------1----------,Agora is much more than a video streaming SDK. One other SDK available from Agora is the Real-time Messaging SDK.,ios development
Async/await operations — a new way of writing asynchronous code,https://barrage.medium.com/async-await-operations-a-new-way-of-writing-asynchronous-code-520488dd99c0?source=topic_page---------20------------------1----------,Async/await mechanism is the new way to write asynchronous code that you traditionally write with a completion handler (known as closure)…,ios development
7 Ways to Link SwiftUI Views to SpriteKit Scene,https://betterprogramming.pub/7-ways-to-link-swiftui-views-to-spritekit-scene-58180a57ab58?source=topic_page---------21------------------1----------,A look at some different ways to link a class with a SwiftUI interface,ios development
The Dark Art of Building an Enterprise-Grade Mobile App — Part 1,https://medium.com/@sundarsingh_2383/the-dark-art-of-building-an-enterprise-grade-mobile-app-part-1-34ff34387deb?source=topic_page---------22------------------1----------,A Mobile App is the epitome of digital presence. It means you care about your customers. It means you’ve found a way into their lives and…,ios development
The Dark Art of Building an Enterprise-Grade Mobile App — Part 2,https://medium.com/@sundarsingh_2383/the-dark-art-of-building-an-enterprise-grade-mobile-app-part-2-950f1d9e911b?source=topic_page---------23------------------1----------,This post is the second post in a series of posts that is part how-to and part journal outlining my journey with Mobile App development…,ios development
Which Mobile Development Framework Is Right For You?,https://javascript.plainenglish.io/which-mobile-development-framework-is-right-for-you-57d0c1bbfaf0?source=topic_page---------24------------------1----------,Which is the Best Choice for Mobile App Development Frameworks In 2021?,ios development
Swift Vs Objective C,https://upstackhq.medium.com/swift-vs-objective-c-c54f8d0091b8?source=topic_page---------25------------------1----------,"If you want to develop the perfect iOS app, you need to decide the language you will be using for the project. Basically, there are two…",ios development
Google login in Ionic Capacitor app with Angular,https://medium.com/enappd/google-login-in-ionic-capacitor-app-with-angular-bb0e8fbba620?source=topic_page---------26------------------1----------,"Learn how to implement Google login in your Ionic Angular Capacitor apps. Test the app in Android, iOS and web",ios development
"Apple Certificates,Identifiers,Devices, Profiles and keys",https://medium.com/@deepakgargavi/ios-certificates-identifiers-devices-profiles-and-keys-5cd224266474?source=topic_page---------27------------------1----------,In this lesson we will try to cover all the topics related to apple developer account(as shown in above image).Like there’s a lot of…,ios development
Programmatic AutoLayout in MVVM,https://medium.com/nerd-for-tech/programmatic-autolayout-in-mvvm-a06cc9e52890?source=topic_page---------28------------------1----------,How to write AutoLayout constraint programmatically in an MVVM app.,ios development
New Date Formatter API in Swift,https://medium.com/geekculture/new-date-formatter-api-f2e6da01d407?source=topic_page---------29------------------1----------,Master the new formatter API with a bunch of helpful examples,ios development
iOS/Swift Series: [#01] Comment,https://medium.com/geekculture/ios-swift-series-01-comment-ec56e0ec9012?source=topic_page---------30------------------1----------,"Use comments to include nonexecutable text in your code, as a note or reminder to yourself. Comments are ignored by the Swift compiler when…",ios development
iOS/Swift Series: [#01] Variables,https://medium.com/geekculture/ios-swift-series-01-variables-5bb07a7c05fc?source=topic_page---------31------------------1----------,"Swift is a fantastic way to write software, whether it’s for phones, desktops, servers, or anything else that runs code. It’s a safe, fast…",ios development
Swift simplified: Completion handler vs return,https://medium.com/@abhijithviswan/swift-completion-handler-vs-return-642ee1de43bf?source=topic_page---------32------------------1----------,"Hello readers,
Today after a very long time i am posting this article which will help you what is the completion handler and its usage and…",ios development
"SignIn with Apple — Integrating a Secure, Fast SignIn with Firebase and iOS in Swift",https://imryohei.medium.com/signin-with-apple-integrating-a-secure-fast-signin-with-firebase-and-ios-in-swift-ff34f52ca3a0?source=topic_page---------33------------------1----------,In this article you will be able to understand and develop Apple SignIn with Firebase and login page for iOS mobile app by the end of this…,ios development
Write Better Swift Code Using With(),https://betterprogramming.pub/better-swift-with-with-4b071b5ac394?source=topic_page---------34------------------1----------,Bring Kotlin like functional patterns to your Swift toolkit,ios development
WWDC 2021 iOS 15- Funny Tricks on UISheetPresentationController,https://itnext.io/ios-15-uisheetpresentationcontroller-d469d144a520?source=topic_page---------35------------------1----------,New Presentation Controller with Two Detents. I encountered two interesting tricky parts during my first trial. Click to understand more.,ios development
JavaScript modules and browser cache,https://marian-caikovski.medium.com/javascript-modules-and-browser-cache-4050b72ec51c?source=topic_page---------0------------------1----------,Can modules be used in production not bundled?,javascript
Introduction to react js,https://medium.com/nerd-for-tech/introduction-to-react-js-116dd228b4a7?source=topic_page---------1------------------1----------,What is react?,javascript
Roadmap to learn React,https://shreyvijayvargiya26.medium.com/roadmap-to-learn-react-7b3d369dbb3f?source=topic_page---------2------------------1----------,To all developer  who want to learn React,javascript
Pokémon Matching Cards: My ReactJS app project,https://haroldtm55.medium.com/pok%C3%A9mon-matching-cards-my-reactjs-app-project-8f69bee496a2?source=topic_page---------4------------------1----------,"I’ll share my reflections on the React learning process of my Software Engineering studies, including my final project called Pokémon…",javascript
The Real Way to Become a Good Programmer,https://javascript.plainenglish.io/the-real-way-to-become-a-good-programmer-e2a44dbd9166?source=topic_page---------5------------------1----------,"With my limited time, which path should I follow, technologies to use, and areas to explore?",javascript
Angular for everyone: Chapitre 2 Component,https://medium.com/@redin.gaetan/angular-for-every-one-chapter-2-component-3e6e4a93f4e1?source=topic_page---------6------------------1----------,I assume you have already read this article: Directives,javascript
"Sending HTML file in response, Serving static files using Express JS | Getting started with Node JS",https://akshattriv.medium.com/sending-html-file-in-response-serving-static-files-using-express-js-getting-started-with-node-js-5b43b5718d94?source=topic_page---------7------------------1----------,"Hi there, so in this article, I’ll tell you guys about how you can send an HTML file in response to a request and How to serve static files…",javascript
An Introduction to Redis Stream,https://javascript.plainenglish.io/an-introduction-to-redis-stream-57445a21751e?source=topic_page---------8------------------1----------,How to use Redis Streams to effectively manage data consumption and persist data.,javascript
How to Draw Stars with JavaScript and HTML5 Canvas,https://nevkatz.medium.com/how-to-draw-stars-with-javascript-and-html5-canvas-33ece95c19bf?source=topic_page---------9------------------1----------,Let’s create a library that handles the details so we can focus on the big picture.,javascript
How to Use JavaScript and Node.js to Fight a Dragon,https://gitstacks.com/how-to-use-javascript-and-node-js-to-fight-a-dragon-f228f790eeab?source=topic_page---------10------------------1----------,A step by step guide to building a simple command-line terminal game,javascript
Building a Social Media App With Python 3 & Django Beginners Tutorial 19: Tags (Part 2 of 2),https://legionscript.medium.com/building-a-social-media-app-with-python-3-django-beginners-tutorial-19-tags-part-2-of-2-76acb235c926?source=topic_page---------11------------------1----------,We will finish tags in this tutorial.,javascript
JavaScript Tutorial: Event Handling on a form button,https://alyssa-e-easterly.medium.com/javascript-tutorial-event-handling-on-a-form-button-f5da05f49a29?source=topic_page---------12------------------1----------,3 step guide for building eventListener in a form button.,javascript
How to Export HTML Table to a CSV File,https://muhimasri.medium.com/how-to-export-html-table-to-a-csv-file-11f01373949d?source=topic_page---------13------------------1----------,A full example of how to export an HTML table to a CSV file with only a few lines of code,javascript
Develop an Appointment App with React and Tailwind CSS,https://javascript.plainenglish.io/develop-an-appointment-app-with-react-and-tailwind-css-part-15-28b91e0137e9?source=topic_page---------14------------------1----------,Part 15. Setting up the sort,javascript
How to Get the Closest Number to a Number Out of a JavaScript Array?,https://javascript.plainenglish.io/how-to-get-the-closest-number-to-a-number-out-of-a-javascript-array-1eb31b18e836?source=topic_page---------15------------------1----------,"Sometimes, we may want to get the closest number to a given number out of a JavaScript array.",javascript
How to Unflatten a JSON Object with JavaScript?,https://javascript.plainenglish.io/how-to-unflatten-a-json-object-with-javascript-933d3c74768a?source=topic_page---------16------------------1----------,"Sometimes, we want to unflatten a JSON object with JavaScript.",javascript
How to Set the Keyboard Caret Position of an HTML Text Box with JavaScript?,https://javascript.plainenglish.io/how-to-set-the-keyboard-caret-position-of-an-html-text-box-with-javascript-fef7caa036a3?source=topic_page---------17------------------1----------,"Sometimes, we want to set the keyboard carte position of an HTML text box with JavaScript.",javascript
"10 JS Tips to Help You Code Smarter, Not Longer",https://medium.com/codesphere-cloud/10-js-tips-to-help-you-code-smarter-not-longer-1e411b1cd9f1?source=topic_page---------18------------------1----------,"Among the top reasons that developers feel burnt out are high workload, personal life, and inefficient processes.",javascript
How to use and reuse everything in SVG… even animations,https://medium.com/leniolabs/how-to-use-and-reuse-everything-in-svg-even-animations-d2c54eb3d905?source=topic_page---------19------------------1----------,by Mariana Beldi,javascript
Composing React Components,https://medium.com/brainly/composing-react-components-8d0b3560ffe6?source=topic_page---------20------------------1----------,How to avoid the Wrong Abstraction using Wet Code,javascript
What are Pure Functions?,https://javascript.plainenglish.io/what-are-pure-functions-95c7bd605e26?source=topic_page---------21------------------1----------,"Pure functions are incredibly restrictive, but that restrictive nature is what makes them so useful.",javascript
Frontend JavaScript Interview Coding Questions & Answers (2021),https://javascript.plainenglish.io/frontend-javascript-interview-coding-questions-answers-2021-12ce7bdef504?source=topic_page---------22------------------1----------,Brush up on the most common coding problems before diving into the FE interview.,javascript
JavaScript Promises: Let’s ‘Settle’ This Once and For All,https://javascript.plainenglish.io/promise-in-javascript-94ea3795c7ad?source=topic_page---------23------------------1----------,"Promises have been the most confusing topics for beginners in JavaScript. Two years before I was also like you, hesitating to discuss…",javascript
Automating templated file / folder structure creation in vscode,https://gaurav5430.medium.com/automating-templated-file-folder-structure-creation-in-vscode-69dfca56ac68?source=topic_page---------24------------------1----------,Automating a repetitive folder / file structure using a vscode extension,javascript
Algorithms: Best Time to Buy and Sell Stock,https://javascript.plainenglish.io/algorithm-best-time-to-buy-and-sell-stock-bf5309195a4b?source=topic_page---------25------------------1----------,Congratulations! You’ve been given the inside scoop on some stock prices for a week (without all the nasty ramifications of insider…,javascript
How To Use React Native Over The Air (OTA) Updates,https://medium.com/pagepro/how-to-use-react-native-over-the-air-ota-updates-9ce455fc204d?source=topic_page---------26------------------1----------,Over The Air updates is a powerful tool that you can add to React Native with ease. Learn how to add them to your app and why it’s worth…,javascript
"Happy Birthday, WWW — 30 years of mining a landfill for valid code",https://chrisheilmann.medium.com/happy-birthday-www-30-years-of-mining-a-landfill-for-valid-code-ae936c396e38?source=topic_page---------27------------------1----------,Today the World Wide Web is 30 years old. I’ve worked on it since 1997 or so and I saw a lot of technologies and design trends come and go…,javascript
The Problem with Returning Values from Async Await Functions,https://javascript.plainenglish.io/problem-with-returning-values-from-async-await-function-javascript-e99c94a47ca5?source=topic_page---------28------------------1----------,"In JavaScript it’s quite annoying sometimes when you’re not aware of how things work, you start scratching your head but you will not find…",javascript
Why WASM is not the future of Babylon.js,https://babylonjs.medium.com/why-wasm-is-not-the-future-of-babylon-js-5832b09c9b10?source=topic_page---------29------------------1----------,(at least for now)…,javascript
"Deployment Nginx with ExpressJS, MongoDB by SSH.",https://medium.com/@yinyuman96/deployment-nginx-with-expressjs-mongodb-by-ssh-b5d28607b403?source=topic_page---------30------------------1----------,Process of deploying a NodeJS or ExpressJS project using MongoDB on the VPS.,javascript
The Most Important Thing I Learned In Business as a Software Engineer,https://javascript.plainenglish.io/the-most-important-thing-i-learned-in-business-as-a-software-engineer-479aaa589ec?source=topic_page---------31------------------1----------,"Is writing code just writing code, where is the understanding at this stage, where have we made mistakes for years, and where are we still…",javascript
Rendering 3d offscreen: Getting max performance using canvas workers,https://itnext.io/rendering-3d-offscreen-getting-max-performance-using-canvas-workers-88c207cbcdc2?source=topic_page---------32------------------1----------,The OffscreenCanvas Web API enables us to transfer the ownership of Canvas DOM elements into workers.,javascript
Web APIs — A Brief Introduction for Beginners,https://javascript.plainenglish.io/web-apis-a-brief-introduction-for-beginners-75dae32e68a8?source=topic_page---------33------------------1----------,Do you know about the thing that surrounds the lives of developers? Brace yourself … APIs are coming.,javascript
Best JavaScript IDE and Source Code Editors for Web Developers,https://javascript.plainenglish.io/best-javascript-ide-and-source-code-editors-for-web-developers-7aaf99ba5423?source=topic_page---------34------------------1----------,Top JavaScript IDEs and Code Editors with noteworthy features,javascript
Data Structures: Linked List,https://dirklo.medium.com/data-structures-linked-list-85c9382f1fbb?source=topic_page---------35------------------1----------,"Last week I dove in to the hash table data structure, and while the implementation is pretty straight-forward, it often hinges on another…",javascript
Linear Regression For absolute beginners in 5 minutes,https://medium.com/@tanishayadav10000/linear-regression-for-absolute-beginners-in-5-minutes-7e49811497f1?source=topic_page---------0------------------1----------,Linear regression with gradient descent in machine learning,machine learning
Tools for Efficient Deep Learning,https://medium.com/@contacttejasvi/tools-for-efficient-deep-learning-c9585122ded0?source=topic_page---------1------------------1----------,It’s been more than a year since I have been getting my hands dirty doing deep learning. Libraries like PyTorch and Keras make it easier to…,machine learning
The 3 levels of Natural Language Understanding,https://espaceship.medium.com/the-3-levels-of-natural-language-understanding-18f64bd2061c?source=topic_page---------2------------------1----------,"Early this year, natural language model “Wudao 2.0”, which has 1.75 trillion parameters (10x GPT-3) was presented in Beijing, China. It’s…",machine learning
Review — Pelee: A Real-Time Object Detection System on Mobile Devices,https://medium.com/nerd-for-tech/review-pelee-a-real-time-object-detection-system-on-mobile-devices-65fa30fa93c2?source=topic_page---------4------------------1----------,Pelee = Proposed PeleeNet as Backbone + Modified SSD as Object Detection Network (Image Classification & Object Detection),machine learning
An Introduction to Linear Algebra for Deep Learning,https://taha-huraibb99.medium.com/an-introduction-to-linear-algebra-for-deep-learning-c1b72de78543?source=topic_page---------5------------------1----------,"Deep learning is all about data, and we need to represent data and perform operations on them to train our deep networks. Data has to be…",machine learning
A list of research papers in Machine learning and Deep learning to read in 2021,https://monochelsea12.medium.com/a-list-of-research-papers-in-machine-learning-and-deep-learning-to-read-in-2021-e690a290ae46?source=topic_page---------6------------------1----------,“Find out the new ideas in Machine learning and Deep learning over here”,machine learning
WHAT IS GENERALIZATION IN MACHINE LEARNING ?,https://magnimind.medium.com/what-is-generalization-in-machine-learning-87951e27187e?source=topic_page---------7------------------1----------,"Before talking about generalization in machine learning, it’s important to first understand what supervised learning is. To answer…",machine learning
Node customization for stunning networks,https://towardsdatascience.com/node-customization-for-stunning-networks-d1f74cf2e46d?source=topic_page---------8------------------1----------,Merging igraph with visNetwork,machine learning
The Difference Between Classification and Regression in Machine Learning,https://towardsdatascience.com/the-difference-between-classification-and-regression-in-machine-learning-4ccdb5b18fd3?source=topic_page---------9------------------1----------,The Problem of Function Approximation,machine learning
A New Take on Analytical Workflow Management,https://towardsdatascience.com/a-new-take-on-analytical-workflow-management-e14b8588cdfe?source=topic_page---------10------------------1----------,"A workflow made by an analytics professional, for analytics professionals",machine learning
Analyzing ML Model using Dashboard,https://towardsdatascience.com/analyzing-ml-model-using-dashboard-f69e17a942f9?source=topic_page---------11------------------1----------,Using Evidently for Creating Machine Learning Model Dashboard,machine learning
Deploy FastAPI on Azure with Github Actions,https://towardsdatascience.com/deploy-fastapi-on-azure-with-github-actions-32c5ab248ce3?source=topic_page---------12------------------1----------,Automate your deployment workflow with Github Actions,machine learning
7 Cool Python Packages Kagglers Are Using Without Telling You,https://towardsdatascience.com/7-cool-python-packages-kagglers-are-using-without-telling-you-e83298781cf4?source=topic_page---------13------------------1----------,Let me reveal the secrets…,machine learning
Mask Detection using YOLOv5,https://towardsdatascience.com/mask-detection-using-yolov5-ae40979227a6?source=topic_page---------14------------------1----------,Explanation of key concepts followed by a simple mask detection implementation using YOLOv5,machine learning
Data-Driven Approach for Schedule Optimizations,https://towardsdatascience.com/data-driven-approach-for-schedule-optimizations-60fdcba1376e?source=topic_page---------15------------------1----------,How to use Google OR-Tools for scheduling problems and visualize the output with Plotly,machine learning
Data Viz meets Death,https://towardsdatascience.com/data-viz-meets-death-a481498f7a58?source=topic_page---------16------------------1----------,Exploring the interaction between the living and the deceased through data visualization,machine learning
An Overview of ML on AWS,https://towardsdatascience.com/an-overview-of-ml-on-aws-d3c0ada16dac?source=topic_page---------17------------------1----------,A comprehensive set of resources for ML offerings from auto-AI services to building custom deep learning models,machine learning
Increasing Model Reliability: Model Selection —  Cross-Validation —,https://towardsdatascience.com/increasing-model-reliability-model-selection-cross-validation-1ce0bf506cd?source=topic_page---------18------------------1----------,Model selection/types to increase result reliability with python implementation in one view.,machine learning
Deploy a Hugging Face Pretrained Model on SageMaker Part1,https://medium.com/@florentjakubowski/deploy-a-hugging-face-pretrained-model-on-sagemaker-part1-ba84622291b0?source=topic_page---------19------------------1----------,Introduction : The goal of this series of articles is to get hands on deployment of Machine Learning Models on Amazon Sagemaker. We follow…,machine learning
Introduction to Recommendation Systems with Tensorflow-Recommenders,https://medium.com/@hamza.emra/introduction-to-recommendation-systems-with-tensorflow-recommenders-a116e5e5a940?source=topic_page---------20------------------1----------,One of the main reasons everybody likes their mother’s or partner’s cooking is that they prepare the specific food for your taste. They…,machine learning
Solving Interview Problems with Deep Learning,https://m.mage.ai/solving-interview-problems-with-deep-learning-4de3fd7e2966?source=topic_page---------21------------------1----------,"It’s been a while since I’ve practiced programming interview questions, and I worry that my skills are lacking. It’s always important to…",machine learning
How to build a Deep Learning system that will answer questions about the Harry Potter universe?,https://radekosmulski.medium.com/how-to-build-a-deep-learning-system-that-will-answer-questions-about-the-harry-potter-universe-3349f89af60c?source=topic_page---------22------------------1----------,"To achieve our goal, which is to build a Q&A system that will answer questions about the Harry Potter universe, we will use NVIDIA Riva and…",machine learning
