Article_Name,Link,About,Skills
A one-character MLflow pull request,https://towardsdatascience.com/a-one-character-mlflow-pull-request-6d135437702d?source=topic_page---------23------------------1----------,"Last week I was tasked with writing a document about best practices for a team of data scientists to coordinate experiments using MLflow, a…",machine learning
Ontology of Deepfakes,https://medium.com/@therealjdb/ontology-of-deepfakes-8507aaa6af88?source=topic_page---------24------------------1----------,A theoretical exploration of what makes a deepfake deep.,machine learning
Visualizing and Preprocessing Image Dataset,https://towardsdatascience.com/visualizing-and-preprocessing-image-dataset-e3ad574f7be6?source=topic_page---------25------------------1----------,Using Tensorbay and SkImage for Visualizing and Preprocessing large datasets,machine learning
Baby steps 3: Linear regression and Logistic regression,https://noraea.medium.com/baby-steps-3-linear-regression-and-logistic-regression-9bee35bee5f4?source=topic_page---------26------------------1----------,"Two very important supervised learning algorithms are linear regression and logistic regression. These algorithms take in features, which…",machine learning
Why should you leverage transfer learning?,https://azunre.medium.com/why-should-you-leverage-transfer-learning-14d08a60f616?source=topic_page---------27------------------1----------,The following is an extract from my newly released book “Transfer Learning for Natural Language Processing”. The extract summarizes some…,machine learning
Autoencoders: Introduction and Practical Applications,https://towardsdatascience.com/autoencoders-introduction-and-practical-applications-3eb7b5c1c7fd?source=topic_page---------28------------------1----------,Autoencoders are probably the first neural networks to come to one’s mind when we think of unsupervised learning approaches. It is widely…,machine learning
"Hands-On Climate Time Series Classification with Deep Learning, using Python",https://towardsdatascience.com/hands-on-climate-time-series-classification-with-deep-learning-using-python-6d5de81004c9?source=topic_page---------29------------------1----------,"Here’s how to build a Deep Neural Network for Time Series Classification, with few lines of code",machine learning
Use this clustering method if you have many outliers,https://towardsdatascience.com/use-this-clustering-method-if-you-have-many-outliers-5c99b4cd380d?source=topic_page---------30------------------1----------,The k-medians variation for robust outcomes,machine learning
Core ML,https://nadiaahmadian.medium.com/core-ml-e840938a55d9?source=topic_page---------31------------------1----------,CoreML is Apple’s almost new machine learning framework that enables us to make our apps more intelligent.,machine learning
Digital Image Thresholding Techniques…,https://medium.com/@shashikadilhani97/digital-image-thresholding-techniques-969b006c9e07?source=topic_page---------32------------------1----------,Types of image thresholding techniques…,machine learning
Sneak view into TensorFlow library and simple implementation of NAND,https://adityagoel123.medium.com/sneak-view-into-tensorflow-library-and-simple-implementation-of-nand-9baed86bcc48?source=topic_page---------33------------------1----------,Introduction to TensorFlow :- TensorFlow is a library which is used by another library known as Keras. TensorFlow sits on the top of…,machine learning
Digital Image Processing Filters,https://medium.com/@shashikadilhani97/digital-image-processing-filters-832ec6d18a73?source=topic_page---------34------------------1----------,Types of images filters and smoothing techniques….,machine learning
Dealing with Complex and Nested Data,https://piexchange.medium.com/dealing-with-complex-and-nested-data-98bbbae4fa6c?source=topic_page---------35------------------1----------,"Often, datasets contain complex data types, such as nested JSON arrays. These values can be difficult to wrangle. This article presents…",machine learning
Automated Product Trials or Demos,https://medium.com/dynamic-python/automated-product-trials-or-demos-1d004a632004?source=topic_page---------0------------------1----------,Docker Swarm meets automated Orchestration with WebDAV or all things!,programming
Local Virtual Environments for your Python code.,https://medium.com/road-to-full-stack-data-science/local-virtual-environments-for-your-python-code-42ed9e3a844d?source=topic_page---------1------------------1----------,Don’t break your code! Don’t lose your code! A short guide for data scientists,programming
Start a journey into the .NET Profiling APIs,https://chnasarre.medium.com/start-a-journey-into-the-net-profiling-apis-40c76e2e36cc?source=topic_page---------2------------------1----------,This is the first episode of a series digging into the .NET Profiling API to trace each method call parameters and return value.,programming
Testing HTTP servers in Go,https://iammehdi.medium.com/testing-http-servers-in-go-6b527fe5a4b6?source=topic_page---------4------------------1----------,These days writing automated tests for your software is just as important as any other phase in the development life cycle.,programming
Surviving the Pandemic as a Developer,https://medium.com/bugless/surviving-the-pandemic-as-a-developer-449fe9d42dd3?source=topic_page---------5------------------1----------,"Create interesting workplace encounters, cultivate a learning friendly environment and talking to a rubber duck.",programming
Row-wise and column-wise operations in dplyr and tidyverse,https://yingqijing.medium.com/column-wise-and-row-wise-operations-in-dplyr-and-tidyverse-da3638b5f46c?source=topic_page---------6------------------1----------,"With the development of dplyr or its umbrella package tidyverse, it becomes quite straightforward to perform operations over columns or…",programming
The 1 Analogy Lasting Your Entire Coding Career About Node.Js,https://medium.com/nerd-for-tech/the-1-analogy-lasting-your-entire-coding-career-about-node-js-514076e1ee?source=topic_page---------7------------------1----------,A little but yet powerful visualization about Node.js core architecture,programming
Learning to ‘Hack Android’ with picoCTF,https://sp4ghetticode.medium.com/learning-to-hack-android-with-picoctf-4d1334eb6929?source=topic_page---------8------------------1----------,A beginners guide to solving picoCTF’s ‘droid’ challenges,programming
Version Control System - Git: Setup,https://medium.com/@prathore28647/version-control-system-git-setup-15e3764f812?source=topic_page---------9------------------1----------,"In this article, we will see how to set up a GitHub account and create a new repository",programming
Enable Unity Ads in Mobile Games,https://valdarixgames.medium.com/enable-unity-ads-in-mobile-games-8eab9e1d358e?source=topic_page---------10------------------1----------,//Welcome to the dark side,programming
Deep Dive to Data Replication,https://rohitgoel11.medium.com/deep-dive-to-data-replication-b0a6bd8a3171?source=topic_page---------11------------------1----------,Replication means creating and maintaining the copy of data on multiple nodes connected via a network. There are various reasons where data…,programming
"The Great Fleece: Point & Click Movement, Part 3",https://reisuj.medium.com/the-great-fleece-point-click-movement-part-3-54baf20042e4?source=topic_page---------12------------------1----------,"Now that the scripting to determine the coordinates when the screen is left-clicked is completed, it’s time to have the Player actually…",programming
The art of problem-solving in programming industry,https://medium.com/codewriters/the-art-of-problem-solving-in-programming-industry-8e78512d5c17?source=topic_page---------13------------------1----------,The Why? and How? behind the backbone of the whole programming industry — problem-solving,programming
Developers Shouldn’t be Afraid of Deadlocks in SQL Server,https://esashamathews.medium.com/developers-shouldnt-be-afraid-of-deadlocks-in-sql-server-8f8f4578675f?source=topic_page---------14------------------1----------,The strategy to deal with deadlocks for backend developers.,programming
Scoped Storage Support in Practo’s Android Apps,https://medium.com/@parassidhu/scoped-storage-support-in-practos-android-apps-53efd7d182fd?source=topic_page---------15------------------1----------,Scoped Storage was introduced in Android 10 but was not enforced till Android 11 given we use requestLegacyExternalStorage flag in…,programming
How to Mock for Unit Testing,https://medium.com/c-sharp-progarmming/how-to-mock-for-unit-testing-644ef7323196?source=topic_page---------16------------------1----------,I have got the discussion with my colleague about unit testing with some scenario that his/her target function will involved into others…,programming
Kubernetes Deployment Explained,https://medium.com/geekculture/kubernetes-deployment-explained-9b2b89dd3977?source=topic_page---------17------------------1----------,Learn what is Deployment in the Kubernetes cluster and learn the advantages of the Deployment object.,programming
Updating the Shooting Logic,https://gert-coppens100.medium.com/updating-the-shooting-logic-32130df5f76a?source=topic_page---------18------------------1----------,"Let’s tweak the behaviour for shooting projectiles with the laser weapon.
Currently when a key is pressed, our weapon only shoots once…",programming
The Tested Way to Build a UI Test Automation Framework,https://cerberus-testing.medium.com/the-tested-way-to-build-a-ui-test-automation-framework-39348b2eda18?source=topic_page---------19------------------1----------,Delivering successful user interfaces is one of the main challenges of digital transformation. We must constantly iterate to improve the…,programming
Python GUI Application Development,https://alpha2phi.medium.com/python-gui-application-development-34239123113e?source=topic_page---------20------------------1----------,Libraries and toolkits to develop GUI applications in Python.,programming
How to get an opportunity of an innovative project from scratch?,https://tsuyoshiushio.medium.com/how-to-get-an-opportunity-of-an-innovative-project-from-scratch-5f4f7974b5ed?source=topic_page---------21------------------1----------,Many people working on add feature/improvement on legacy code. Not many people working on designing from scratch and write code for brand…,programming
The error message that every MySQL user knows,https://blog.database.guru/the-error-message-that-every-mysql-user-knows-cf3dccc92df1?source=topic_page---------22------------------1----------,But do you really understand what it means?,programming
Github Top 5 Bag of Tricks,https://codenamewei.medium.com/github-top-5-bag-of-tricks-4cecb4cd3dbb?source=topic_page---------23------------------1----------,Essential tips when working with Github in web browser,programming
Understanding the Algorithm behind Merge Sort for Linked Lists,https://medium.com/javarevisited/understanding-the-algorithm-behind-merge-sort-for-linked-lists-79ef7f6f2f94?source=topic_page---------24------------------1----------,What is a Merge Sort?,programming
Joining Strategies in Apache Spark,https://krishnaprasad-k.medium.com/joining-strategies-in-apache-spark-f802a7dab150?source=topic_page---------25------------------1----------,Apache spark is one of the widely used analytics engine for data processing. Spark provides a wide range of APIs for performing analytics…,programming
"We have grounding problems, time to fix it!",https://asealiea.medium.com/we-have-grounding-problems-time-to-fix-it-a35e17dd395?source=topic_page---------26------------------1----------,Objective: Fixing the issues with the raycasting for IsGrounded.,programming
Remote Engineering Should Not Mean Engineering Alone,https://medium.com/facet-engineering/remote-engineering-should-not-mean-engineering-alone-b826e1ae3bc4?source=topic_page---------27------------------1----------,"Facet Engineering is a fully distributed, remote-first team. Being remote offers tremendous flexibility and a literal world of talent, but…",programming
"Choose The Right Cloud Model For Your Business: IaaS, PaaS, and SaaS",https://medium.com/instinctools/choose-the-right-cloud-model-for-your-business-iaas-paas-and-saas-31ba4f56e845?source=topic_page---------28------------------1----------,"Today’s world is flooded with anything-as-a-service. Restaurants provide meals-as-a-service, travel agencies offer holidays-as-a-service…",programming
Monetize your Games with Reward Ads in Unity,https://mike-87852.medium.com/monetize-your-games-with-reward-ads-in-unity-6d7ef92415cf?source=topic_page---------29------------------1----------,"Grinding your way through a level to accrue enough gold for that shiny new sword, used to standard practice in gaming. It can be time…",programming
Productivity tools from Internet3.0,https://erma0x.medium.com/productivity-tools-from-internet3-0-9cf4fe04552e?source=topic_page---------30------------------1----------,--------,programming
Serverless Kafka in a Cloud-native Data Lake Architecture,https://kai-waehner.medium.com/serverless-kafka-in-a-cloud-native-data-lake-architecture-216196d398cb?source=topic_page---------31------------------1----------,Understand how to leverage cloud-native and serverless Apache Kafka on hybrid cloud to process data in motion complementary to the data…,programming
Designing a library for inter-service communication in SOA,https://medium.com/nerd-for-tech/designing-a-library-for-inter-service-communication-in-soa-6c4b297be422?source=topic_page---------32------------------1----------,My previous article was about additional complexity that appears when one splits a monolithic system into parts. The basic idea is that…,programming
What is Coding?,https://wen-mcnair.medium.com/what-is-coding-a8f4200e502?source=topic_page---------33------------------1----------,Cracking the code to take the mystery out of coding,programming
Implementing Unity’s New Input Controls,https://mike-87852.medium.com/implementing-unitys-new-input-controls-8131dece5fb5?source=topic_page---------34------------------1----------,"If you have used input that is more complex than simple horizontal/vertical movement, you have struggled assigning button presses to…",programming
The Future of Software Development in 2021 and Beyond,https://medium.com/instinctools/the-future-of-software-development-in-2021-and-beyond-6eb8e65c191f?source=topic_page---------35------------------1----------,"The year 2020 stormed into our lives, bringing changes that most of us were not ready for. Businesses had to either take the path of…",programming
The Counselor as a Person and as a Professional,https://medium.com/psych-pstuff/the-counselor-as-a-person-and-as-a-professional-ff74e04e5686,"In the realm of psychotherapy, the personality of the counselor and its subsequent effect on the course of therapy and the therapeutic…",psychology
The Secret to Resilience,https://medium.com/the-thrive-project/the-secret-to-resilience-659b4bfa7cea?source=topic_page---------1------------------1----------,How your peer network enhances coping skills.,psychology
Munchausen’s Syndrome by Internet (MbI or MBI): Isolated Incidents or a New Disorder?,https://medium.com/beingwell/munchausens-syndrome-by-internet-mbi-or-mbi-isolated-incidents-or-a-new-disorder-9b86869c3b52?source=topic_page---------2------------------1----------,"A disorder of fictitious physical illnesses may require an extension to include a new psychiatric category, according to research now…",psychology
The Surprising Benefits of Talking to Strangers,https://medium.com/the-atlantic/the-surprising-benefits-of-talking-to-strangers-1affcba02ebd?source=topic_page---------4------------------1----------,So many of us have been raised to see strangers as dangerous and scary. What would happen if we instead saw them as potential sources of…,psychology
The Scrambled Brain of the Narcissist,https://medium.com/narcissistic-abuse-recovery-collaborators/the-scrambled-brain-of-the-narcissist-d87bfbd4bff5?source=topic_page---------5------------------1----------,The Structural Integrity of the Brain with NPD is Compromised,psychology
What do we actually know?,https://koenfucius.medium.com/what-do-we-actually-know-e9d98cacb426?source=topic_page---------6------------------1----------,Much of what we think we know is built on the powdery sands of conjecture and assumptions,psychology
How Science Explains Ouija Boards,https://medium.com/i-wanna-know/how-science-explains-ouija-boards-7b478586956e?source=topic_page---------7------------------1----------,It’s not exactly ghosts,psychology
Force of Habit,https://medium.com/snipette/force-of-habit-41fcb31d509?source=topic_page---------8------------------1----------,Neural firing and wiring in our most stubborn behaviours,psychology
The Iowans Who Changed Psychology,https://medium.com/park-recommendations/the-iowans-who-changed-psychology-bfcbb0628856?source=topic_page---------9------------------1----------,"A review of *The Orphans of Davenport: Eugenics, the Great Depression, and the War over Children’s Intelligence* by Marilyn Brookwood",psychology
"Fear of Change: Reasons, Psychology, Tips & Quotes",https://zoestellaxy.medium.com/fear-of-change-reasons-psychology-tips-quotes-9e56c7212f34?source=topic_page---------10------------------1----------,"Many people are afraid of change. 
Nobody knows exactly what is changing and what you are getting into. Leaving the security of the status…",psychology
“How Do I Find the Right Therapist for Me?”,https://kaylalane.medium.com/how-do-i-find-the-right-therapist-for-me-38673376c80e?source=topic_page---------11------------------1----------,Sometimes the hardest part of asking for help is knowing where to start and who to turn to.,psychology
Why I Won’t Deal With My Phobia of Mice,https://laurafriedmanwilliams.medium.com/why-i-wont-deal-with-my-phobia-of-mice-9689f199ffbf?source=topic_page---------12------------------1----------,"On loss, depression, and the reigning terror of a tiny four-legged creature",psychology
Why Therapy Shouldn’t Entirely Replace Punishment,https://medium.com/island-of-misfit-articles/why-therapy-shouldnt-entirely-replace-punishment-cad10338a7?source=topic_page---------13------------------1----------,Responding to Karl Menninger’s “Therapy Not Punishment”,psychology
How to Love Without Experiencing Attachment Suffering,https://medium.com/@andy.a.g/how-to-love-without-experiencing-attachment-suffering-9d8d47f76f16?source=topic_page---------14------------------1----------,The Contradiction of Scientific Love and Spiritual Detachment,psychology
Jung’s Collective Unconscious Explained,https://medium.com/the-living-philosophy/jungs-collective-unconscious-explained-66722d7f2720?source=topic_page---------15------------------1----------,The strange story of the depths of the unconscious,psychology
The 5 Personality Patterns: Which One Fits You?,https://medium.com/easeability/the-5-personality-patterns-which-one-fits-you-4e7616c2862f?source=topic_page---------16------------------1----------,Learn about your personality pattern and how to move out of pattern into wholeness for a happier and healthier life,psychology
"Decisions, Decisions, Decisions",https://medium.com/psych-pstuff/decisions-decisions-decisions-1d10e0ddfaf1?source=topic_page---------17------------------1----------,Common Approach to Problem Solving and Decision-Making,psychology
3 Tips That Help to Overcome Formidable Tasks,https://medium.com/mind-cafe/3-tips-that-help-to-overcome-formidable-tasks-1766b8d01094?source=topic_page---------18------------------1----------,From a fellow overthinker.,psychology
Thanos Probably Is No Match to the Tyrants in Real Life,https://chumark54.medium.com/thanos-probably-is-no-match-to-the-tyrants-in-real-life-c09e9c77e6c4?source=topic_page---------19------------------1----------,"In my opinion, the best he can achieve is just a small dictator",psychology
"Yes, Drugs Are Amazing – But Official Warnings Are Not Enough",https://medium.com/happy-brain-club/yes-drugs-are-amazing-but-official-warnings-are-not-enough-154dca97b99e?source=topic_page---------20------------------1----------,This advocate for psychedelics has a warning for the curious,psychology
7 Psychological Reasons You Don’t Trust Yourself,https://nickwignall.medium.com/7-psychological-reasons-you-dont-trust-yourself-e7030e4b4956?source=topic_page---------21------------------1----------,Let these bad habits go and your natural self-confidence will rise,psychology
We’re Watching the Beautiful Killing of Bias,https://emaxklein.medium.com/were-watching-the-beautiful-killing-of-bias-e34ce1700005?source=topic_page---------22------------------1----------,Human nature is a dictator we’re slowly starting to subdue,psychology
Transference Machines:,https://medium.com/@filip.andjelkovic/transference-machines-9bb47df73500?source=topic_page---------23------------------1----------,What Psychoanalysis and Media Theory Have to Say About Our Online Fantasies,psychology
Watch Out for These 4 Cognitive Biases You Fall To Make Better Decisions,https://medium.com/mind-cafe/watch-out-for-these-4-cognitive-biases-you-fall-to-make-better-decisions-89e440740cf4?source=topic_page---------24------------------1----------,The psychology of decision-making.,psychology
How to Immediately Interrupt Escalating Anxiety Using Cognitive Distraction,https://betterhumans.pub/how-to-immediately-interrupt-escalating-anxiety-using-cognitive-distraction-43248c158142?source=topic_page---------25------------------1----------,A psychologist tested technique for quickly decreasing anxiety,psychology
The Ethical Implications of Using Memory Implants to Treat Mental Illnesses,https://medium.com/@mc131q/the-ethical-implications-of-using-memory-implants-to-treat-mental-illnesses-26cc4bf11493?source=topic_page---------26------------------1----------,"As memory implantation technology develops, we must address its bioethical concerns.",psychology
"I’m a Nice Guy, Just Ignore the Bodies",https://superjumpmagazine.com/im-a-nice-guy-just-ignore-the-bodies-1d8e53ba3568?source=topic_page---------27------------------1----------,Uncharted’s Nathan Drake has killed hundreds: why don’t players care?,psychology
Please Don’t Take My Collective Effervescence Away,https://medium.com/@artchangeslives/please-dont-take-my-collective-effervescence-away-de839499b774?source=topic_page---------28------------------1----------,Key points,psychology
The Architecture of Memory — The Atkinson-Shiffin Model,https://medium.com/psych-pstuff/the-architecture-of-memory-the-atkinson-shiffin-model-cf746d8ed73b?source=topic_page---------29------------------1----------,"The Atkinson-Shiffin model, also referred to as the multi-store approach, describes the basic architecture of the memory system and has…",psychology
"How Heuristics, Attributions, and Biases Show Us That Reality Is an Illusion",https://medium.com/preoccupy-negative-thoughts/how-heuristics-attributions-and-biases-show-us-that-reality-is-an-illusion-5b8c7c8820eb?source=topic_page---------30------------------1----------,"They help us understand, predict, and control the world around us.",psychology
How online learning affects us,https://medium.com/age-of-awareness/how-online-learning-affects-us-db78914aa6a1?source=topic_page---------31------------------1----------,Exploring the effects of “a click away” information,psychology
Parent(ification) Trap: The Hidden Side of Role-Reversals,https://medium.com/change-becomes-you/parent-ification-trap-the-hidden-side-of-role-reversals-559510510565?source=topic_page---------32------------------1----------,When a child is asked to parent their parent.,psychology
The Science of Fear,https://medium.com/amateur-book-reviews/the-science-of-fear-eaf774b0f04c?source=topic_page---------33------------------1----------,"I am going to dust off the cover of a book that has been on my bookshelf for over a decade, but which is as relevant today as when first…",psychology
How to Use Your Brain’s Processing Power to Increase Emotional Intelligence,https://medium.com/invisible-illness/how-to-use-your-brains-processing-power-to-increase-emotional-intelligence-5a13b355e1ae?source=topic_page---------34------------------1----------,"Life isn’t just happening to you, but you’re shaping it.",psychology
SAFe vs Scrum discussions — a supposedly Skub debate with quite a lot of implications,https://maciejjarosz.medium.com/safe-vs-scrum-discussions-a-supposedly-skub-debate-with-quite-a-lot-of-implications-a0edf2e18b4a?source=topic_page---------0------------------1----------,Or  how paradigm wars serve business continuity,software engineering
"Why Sharding Gets Hard, and Why You Need Vitess",https://andrewjdawson2016.medium.com/why-sharding-gets-hard-and-why-you-need-vitess-3424fd6a35e3?source=topic_page---------1------------------1----------,"Once upon a time, there was a company called TubeYou. TubeYou was a video sharing platform which was expanding very rapidly. When they…",software engineering
My path towards the PSM III certificate,https://medium.com/serious-scrum/my-journey-to-psm-iii-bbb544dbc296,The PSM III certification of scrum.org is thought of to be the hardest Scrum Master certification achievable. There are — at the time of…,software engineering
What is Domain Driven Design (DDD) — Part 1,https://medium.com/missguidedtechblog/what-is-domain-driven-design-ddd-part-1-afd94b72045d,As with anything DDD is not a silver bullet. It won’t suit everyone and their styles and you don’t need to use all of it. My style tends to…,software engineering
